{"caseCatalogSha256":"b10c793a29114a7d92f048156b433056cfc8a81b0646dddf0ea1e954a3f381da","cases":[{"capabilityId":null,"caseId":"UAT-ACCESS-001","httpStatus":401,"status":"unauthenticated"},{"capabilityId":null,"caseId":"UAT-ACCESS-002","httpStatus":401,"status":"unauthenticated"},{"capabilityId":null,"caseId":"UAT-ACCESS-003","httpStatus":400,"status":"invalid_argument"},{"capabilityId":null,"caseId":"UAT-ACCESS-004","httpStatus":422,"status":"unsupported"},{"capabilityId":"employee.detail","caseId":"UAT-EMPLOYEE-001","httpStatus":200,"status":"success"},{"capabilityId":"employee.detail","caseId":"UAT-EMPLOYEE-002","httpStatus":200,"status":"success"},{"capabilityId":"employee.detail","caseId":"UAT-EMPLOYEE-003","httpStatus":403,"status":"forbidden"},{"capabilityId":null,"caseId":"UAT-EMPLOYEE-004","httpStatus":400,"status":"invalid_argument"},{"capabilityId":"transaction.search","caseId":"UAT-TRANSACTION-001","httpStatus":200,"status":"success"},{"capabilityId":"transaction.search","caseId":"UAT-TRANSACTION-002","httpStatus":200,"status":"success"},{"capabilityId":"transaction.search","caseId":"UAT-TRANSACTION-003","httpStatus":403,"status":"forbidden"},{"capabilityId":null,"caseId":"UAT-TRANSACTION-004","httpStatus":400,"status":"invalid_argument"},{"capabilityId":null,"caseId":"UAT-TRANSACTION-005","httpStatus":400,"status":"invalid_argument"}],"cleanup":{"ownedProcessesStopped":true,"rawLogsDeleted":true,"runtimeClosed":true},"gitHead":"e05e78c95e5a4b3893df88935e918976d07c4db5","phase":"structured_query","regressions":{"access":"passed","core":"passed","jwtPassThrough":"passed","resolver":"passed","singleAction":"passed"},"requestCounts":{"answerGeneration":0,"embedding":0,"employee":3,"externalModelOutbound":0,"knowledgeSearch":0,"localKnowledgeModel":0,"otherBusinessEndpoints":0,"rerank":0,"transaction":3},"schemaVersion":1,"scope":{"fullUatGateClosed":false,"knowledgeEvaluated":false,"productionEnabled":false},"security":{"logLeakCount":0,"sensitivePersistence":false},"stageEvidenceSha256":{"access":"0c01ceb5b0ca0c94a63cd1a930d23bc2570a9704b34d467cf44b993eb4793057","employee":"7fac2caa7a0aa3f1af80b9bb9a42ecff7a549a19941ba8928e71dd5b4e150458","transaction":"88d15ee04899fb872323d15e6787dc915bcc472e9f6e477566a4531d6591203c"},"status":"passed","suiteId":"single-agent-structured-query-uat-v1"}